name,description,abstract,links,status,tags,contact
hardtarget,Radar hard target processing,General package for hard target processing of radar data in the `digital_rf` format using matched filtering.,[:simple-readthedocs: Documentation](https://danielk.developer.irf.se/hardtarget/);[:fontawesome-brands-github:{ .lg .middle } GitHub repository](https://github.com/danielk333/hardtarget);[:fontawesome-brands-python:{ .lg .middle } PyPI package](https://pypi.org/project/hardtarget/),stable;maintained,hard target;signal processing,[Daniel Kastinen](mailto:daniel.kastinen@irf.se)
rain,ReseArch Infrastructure Network,ReseArch Infrastructure Network (RAIN) is a Python package that allows users to exchange messages between each other. This package was created with the purpose of sending status information between research infrastructure in the Arctic regions of the Nordics.,[:simple-readthedocs: Documentation](https://danielk.developer.irf.se/rain/);[:fontawesome-brands-github:{ .lg .middle } GitHub repository](https://github.com/danielk333/rain);[:fontawesome-brands-python:{ .lg .middle } PyPI package](https://pypi.org/project/pyrain/),stable;maintained,triggering;communication;infrastructure,[Daniel Kastinen](mailto:daniel.kastinen@irf.se)
sorts,Space Object Radar Tracking Simulator,Space Object Radar Tracking Simulator (SORTS) is a collection of modules designed for research purposes concerning the tracking and detection of objects in space. Its ultimate goal is to simulate the tracking and discovery of objects in space using radar systems in a very general fashion.,[:simple-readthedocs: Documentation](https://danielk333.github.io/SORTS/docs/index.html);[:fontawesome-brands-github:{ .lg .middle } GitHub repository](https://github.com/danielk333/sorts),developing;maintained,space debris;tracking;simulation,[Daniel Kastinen](mailto:daniel.kastinen@irf.se)
pyant,Radar gain patterns,"PyAnt is a standardization of implementing radar gain patterns in Python. Nothing more, nothing less.",[:simple-readthedocs: Documentation](https://danielk.developer.irf.se/pyant/);[:fontawesome-brands-github:{ .lg .middle } GitHub repository](https://github.com/danielk333/pyant);[:fontawesome-brands-python:{ .lg .middle } PyPI package](https://pypi.org/project/pyant/),stable;maintained,gain;radiation pattern,[Daniel Kastinen](mailto:daniel.kastinen@irf.se)
metecho,Radar Meteor Head Echo Analysis,Radar Meteor Head Echo Analysis package - metecho. Package for processing radar data measuring meteor head echoes. Mainly focused on fitting meteoroid models to the processed data and performing the additional tasks needed such as calibration and error estimation.,[:simple-readthedocs: Documentation](https://danielk.developer.irf.se/metecho/);[:fontawesome-brands-github:{ .lg .middle } GitHub repository](https://github.com/danielk333/metecho),prototype;developing,gain;radiation pattern,[Daniel Kastinen](mailto:daniel.kastinen@irf.se)
